category,color,word,meaning
Coded Breakfast - Lucy is Listening,,"Bonjour, je suis Marie.","Hello, I am Marie."
Coded Breakfast - Lucy is Listening,,"Bonjour, je suis Louis.","Hello, I am Louis."
Coded Breakfast - Lucy is Listening,,Tu manges une pizza?,Are you eating a pizza?
Coded Breakfast - Lucy is Listening,,"Non, je mange un croissant.","No, I am eating a croissant."
Coded Breakfast - Lucy is Listening,,"Ah, un croissant?","Ah, a croissant?"
Coded Breakfast - Lucy is Listening,,"Oui, et une orange.","Yes, and an orange."